title,review,rating
Without doubts deserves to be called the best hotel in Europe,The spirit of Amsterdam with one look out of the window and perfect hospitality from A-Z. The receptionists not only kind but with personal engagement. The room very comfortable and with good taste arranged until the smallest detail. The breakfast fresh and inspiring. If you are curious and want to know more - the IHG application will lead you fast there...,50
"Didnt mind the old-ish property, as was more displeased with the staff","For background, am just a Gold Eilte IHG member. Stayed at the Amstel for three days for business recently, first time. On the property itself, its nice but there are also many other new and better-facillitied places to stay in Amsterdam for sure. However, what prompted me to write this review was the staff, notably the front desk staff. Curt and abrupt and generally really unhelpful to the extent that I thought to myself 'You people really seem not to want to be at this job and so, why don't you just quit, so that you make way for better staff?'. Doorman never there when you need a cab, ever. Only redeeming part of the service is the housekeeping manager. Not returning unless I can help it.",10
Magical birthday weekend,"If you are looking for a hotel with a soul, look no further. From the moment you enter this stunningly beautiful place, you are in a different world and you are treated like royalty. When we entered our room for the first time, I was overwhelmed by its' beauty. The luch at the hotel restaurant was divine and our lovely waiter gave us excellent service. My husband and I celebrated my birthday weekend at the Amstel Hotel and I cannot imagine it being more special than it was. You will for sure find other beautiful and luxurious hotels in Amsterdam - but none like this one. Staff goes above and beyond to make your stay unforgettable. They not only do their jobs well but they love what they do and you can feel it. On top of that, I cannot emphasise enough the beauty of the",50
Excellent Home when visiting Amsterdam,"We absolutely loved our six night stay at the Amstel Hotel, it far surpassed our expectations. To begin, the staff went above and beyond to make sure we were comfortable. From check in, breakfast each morning - a true highlight, and all the suggestions from the concierge, we were well taken care of. The location is perfect, near enough to walk to everything, but out of the crazy busy area.",50
Nice classic style hotel,We stayed for a winter weekend in lovely Amsterdam and enjoyed the classic style and peace in this hotel. Our room didn't face the river so we felt a little cut off from classic Amsterdam views but the room was very well appointed with everything you could need. Staff were helpful throughout. We paid for breakfast which was nice but at 40 euros each much higher than equivalents in hotels and not as indulgent as the Breakfast club restaurant nearby for 15 euros each. Little off the beaten track but great walking. Taxi from Centraal station was 25 euros and taxi to airport was 60 in rush hour traffic,40
5 stars all around,"A beautiful and massive old building, newly renovated on the corner overlooking the Amstel River. It’s grand and classic and a true historic 5 star hotel. I used an IHG free night certificate to book a Queen Executive city view and was upgraded to a King Executive River view due to my IHG platinum status (it was fairly quiet, I wouldn’t expect this upgrade during busy season). The room was fabulous, high ceilings, tons of space and a huge bathroom with lovely bathtub and separate rainfall shower. Two sets of big windows open up with views over the river and its stunning, especially at sunset. Service is impeccable, as you’d expect at a 5* hotel with sit down checkin, a free glass of prosecco, turndown with sweets and the like. I was given 2pm late checkout based on platinum",50
Amsterdam Adventure,"We recently stayed at the Amstel to celebrate the New Year in Amsterdam. The staff, the property itself, and the location were all perfect for our long weekend. We took the Penthouse Suite, which has a commanding view of the city and was the perfect spot to watch the fireworks. We plan to return to Amsterdam in the warmer weather and surely stay here again. We highly recommend the in-room massage, even more so than the spa - the masseuse was great! Easily one of the best properties in Amsterdam.",50
What a great hotel!,"Fantastic location. Beautiful, classy hotel. The service was what really clinched it for me. We arrived super early, 7am, and I certainly didn't expect to get a room right then (thought we'd just store our luggage and explore), but we were able to check in right away, and got an upgrade to a river view room (Platinum elite thanks to Chase IHG credit card). The staff overall was super attentive and very nice! Thank you, and we will be back :)",50
"Elegant, Fancy Hotel","The cab driver almost drove us off the road when we told her we were heading to the Amstel hotel. She knew all about the history of the hotel, and there's 150 years of history. On the mezzanine, there's even a mini museum of its history. Check-in was very specialized and personal. Ironically, the night before, we stayed at the Holiday Inn Express in Schiphol, and the check-in was 30 seconds there, which I also like. Here, they take a bit longer to ensure your booking details are correct. I've stayed a several Intercontinentals, and this one has the nicest rooms. The room is gorgeous and cozy. It felt like something out of a fairytale. It was spacious and flowery in decoration. The bathroom was also huge, about 1/3 the size of the room. We happened to stay the weekend of",50
Elegant old hotel overlooking the Amstel River,"We booked this grand old hotel on the banks of the Amstel River in Amsterdam at the end of a river cruise. We arrived early, having just embarked from our vessel, and our room was not ready yet. We looked around the public area of the hotel with its magnificent lobby complete with grand staircase to the second floor, lofty ceilings, crystal chandeliers, and lovely huge flower arrangements. The main fine dining room (La Rive) was located off the lobby in a beautiful atrium room adjacent to the terrace overlooking the river. This was also the location for the wonderful breakfast. Down one floor was a more casual dining venue (Brasserie) with a terrace that provided seating along and at the same level as the river. Reception was very formal, but not unfriendly. Same with the",50
Amazing Stay,"From the moment you arrive at the hotel, you receive an absolutely outstanding service. The staff go above and beyond for you and nothing is too much. The room was massive, and the spa facilities were great, with a great view of the river. The hotel is located right next to the metro, making travelling an ease. I will most certainly be staying here again, and I would like to thank all the hotel staff for making my stay so enjoyable.",50
The best high-tea in Amsterdam,I went to the Amstel hotel for the afternoon high-tea to celebrate my birthday. Be sure to arrive on time if not early and expect to be brought to your table group by group. the food was delicious and the tea paring was spot on. A real recommendation should you want something special but different than a dinner to celebrate something nice. The view of the Amstel river from the high-tea room is also breath-taking and peaceful.,50
A lovely classic hotel in Amsterdam,"The Amstel hotel is the grand dame in Amsterdam and it is a lovely hotel to stay in. The rooms are spacious, clean and very classic. The staff is professional and very helpful. The location off course is ideal, central but a bit away from the rumble. The only small comments I have are the shower. Very complicated to handle and slow to react on temperature changes. You always waste a lot of water until you find the right temperature. The other thing is minor but from the top hotel in Amsterdam you expect better. They still have an old sound bar with a iphone 4 docing station..... really???? in 2018????? Please take it away and install a bluetooth device",40
"Good size rooms, friendly staff, great location.","We arrived to a nice greeting and a glass of Proseco. We were early and our room not quite ready, we killed the time by having a late lunch in the restaurant on the water. The staff made us feel at home and let us know when our room was ready. The room had a great view, with windows that could be opened to take it all in! The museums are a 15 minute walk. The shopping district starts 5 minutes away. The hotel is mere minutes from multiple locals, we had a great breakfast around the corner with the locals in a bakery (not the only option). Parking is available at the hotel for $65 (Euro) per day and self parking is also out front for $36 (Euro) for 24 hours (very limited during the week). Self parking has to be paid daily with a CC at the meter. Concierge is very",50
Lovely stay!,Beautiful classic hotel ideally situated with a river view. Simply a perfect stay from Impeccable service to the hotel view/location. We were greeted with a welcome drink. Highly recommended if you prefer luxury over trendy.,50
